{
  "schema": "vrmod-manifest/1",
  "id": "mini-mod",
  "name": "Mini",
  "version": "1.0.0",
  "game": {
    "id": "d2r"
  },
  "exclusive_group": "g",
  "files": [
    {
      "src": "dir/",
      "dst": "{game}/dir/",
      "role": "program",
      "sha256": "0000000000000000000000000000000000000000000000000000000000000000"
    }
  ]
}
