{
  "schema": "vrmod-manifest/1",
  "id": "mini-mod",
  "name": "Mini",
  "version": "1.0.0",
  "game": {
    "id": "d2r"
  },
  "exclusive_group": "g",
  "files": [
    {
      "src": "a.dll",
      "dst": "{game}/a.dll",
      "role": "program"
    },
    {
      "src": "b.dll",
      "dst": "{game}/A.DLL",
      "role": "program"
    }
  ]
}
